{
  "$schema": "https://json-schema.org/draft/2020-12/schema",
  "$id": "https://ed3c.github.io/website-design-compiler/schemas/compiler-input.schema.json",
  "title": "Website Design Compiler Input",
  "type": "object",
  "additionalProperties": false,
  "required": ["schema", "project", "brief", "requestedStages"],
  "properties": {
    "schema": { "const": "website-design-compiler/input/v1" },
    "project": { "type": "string", "minLength": 1 },
    "brief": {
      "type": "object",
      "additionalProperties": false,
      "required": ["pageType", "audience", "objective"],
      "properties": {
        "pageType": { "type": "string", "minLength": 1 },
        "audience": { "type": "string", "minLength": 1 },
        "objective": { "type": "string", "minLength": 1 }
      }
    },
    "hardConstraints": {
      "type": "array",
      "items": { "type": "string", "minLength": 1 },
      "uniqueItems": true,
      "default": []
    },
    "authoredContent": {
      "type": "object",
      "propertyNames": { "type": "string", "pattern": "^[a-z0-9]+(?:-[a-z0-9]+)*$" },
      "additionalProperties": { "type": "string", "minLength": 1 }
    },
    "briefSourceEvidence": {
      "type": "object",
      "additionalProperties": false,
      "required": ["inputSha256", "fields"],
      "properties": {
        "inputSha256": { "type": "string", "pattern": "^[a-f0-9]{64}$" },
        "fields": {
          "type": "object",
          "additionalProperties": false,
          "required": ["pageType", "audience", "objective"],
          "properties": {
            "pageType": { "$ref": "#/$defs/sourceField" },
            "audience": { "$ref": "#/$defs/sourceField" },
            "objective": { "$ref": "#/$defs/sourceField" }
          }
        }
      }
    },
    "references": {
      "type": "array",
      "items": {
        "type": "object",
        "additionalProperties": false,
        "required": ["kind", "value"],
        "properties": {
          "kind": { "enum": ["url", "image", "video", "html"] },
          "value": { "type": "string", "minLength": 1 }
        }
      },
      "default": []
    },
    "artDirection": {
      "type": "object",
      "additionalProperties": false,
      "required": ["primary"],
      "properties": {
        "primary": {"type":"array","items":{"enum":["anthropic-frontend-design","google-stitch","taste-skill","repo-native"]}},
        "reviewers": {"type":"array","uniqueItems":true,"items":{"enum":["anthropic-frontend-design","google-stitch","taste-skill","repo-native"]}}
      }
    },
    "requestedStages": {
      "type": "array",
      "minItems": 1,
      "uniqueItems": true,
      "items": { "type": "string", "minLength": 1 }
    }
  },
  "$defs": {
    "sourceField": {
      "type": "object",
      "additionalProperties": false,
      "required": ["state", "sourceExcerpt"],
      "properties": {
        "state": { "enum": ["EXPLICIT", "INFERRED"] },
        "sourceExcerpt": { "type": "string", "minLength": 1 }
      }
    }
  }
}
